id,genres,imdb_id,original_title,overview,popularity,vote_average,vote_count,cast
205596,History,tt2084970,The Imitation Game,"Based on the real life story of legendary cryptanalyst Alan Turing, the film portrays the nail-biting race against time by Turing and his brilliant team of code-breakers at Britain's top-secret Government Code and Cypher School at Bletchley Park, during the darkest days of World War II.",31.59594,8,5895,Benedict Cumberbatch
10528,Action,tt0988045,Sherlock Holmes,"Eccentric consulting detective, Sherlock Holmes and Doctor John Watson battle to bring down a new nemesis and unravel a deadly plot that could destroy England.",15.68604,7,5883,Benedict Cumberbatch
100402,Action,tt1843866,Captain America: The Winter Soldier,"After the cataclysmic events in New York with The Avengers, Steve Rogers, aka Captain America is living quietly in Washington, D.C. and trying to adjust to the modern world. But when a S.H.I.E.L.D. colleague comes under attack, Steve becomes embroiled in a web of intrigue that threatens to put the world at risk. Joining forces with the Black Widow, Captain America struggles to expose the ever-widening conspiracy while fighting off professional assassins sent to silence him at every turn. When the full scope of the villainous plot is revealed, Captain America and the Black Widow enlist the help of a new ally, the Falcon. However, they soon find themselves up against an unexpected and formidable enemy?îthe Winter Soldier.",18.717704,7.6,5881,Christopher Evans
284052,Action,tt1211837,Doctor Strange,"After his career is destroyed, a brilliant but arrogant surgeon gets a new lease on life when a sorcerer takes him under his wing and trains him to defend the world against evil.",43.847654,7.1,5880,Benedict Cumberbatch
49047,Science,tt1454468,Gravity,"Dr. Ryan Stone, a brilliant medical engineer on her first Shuttle mission, with veteran astronaut Matt Kowalsky in command of his last flight before retiring. But on a seemingly routine spacewalk, disaster strikes. The Shuttle is destroyed, leaving Stone and Kowalsky completely alone-tethered to nothing but each other and spiraling out into the blackness of space. The deafening silence tells them they have lost any link to Earth and any chance for rescue. As fear turns to panic, every gulp of air eats away at what little oxygen is left. But the only way home may be to go further out into the terrifying expanse of space.",18.50194,7.3,5879,Sandra Bullock
131631,Science,tt1951265,The Hunger Games: Mockingjay - Part 1,Katniss Everdeen reluctantly becomes the symbol of a mass rebellion against the autocratic Capitol.,147.098006,6.6,5767,Jennifer Lawrence
674,Adventure,tt0330373,Harry Potter and the Goblet of Fire,"Harry starts his fourth year at Hogwarts, competes in the treacherous Triwizard Tournament and faces the evil Lord Voldemort. Ron and Hermione help Harry manage the pressure ??but Voldemort lurks, awaiting his chance to destroy Harry and all that he stands for.",24.903058,7.5,5758,Daniel Radcliffe
329865,Thrill,tt2543164,Arrival,"Taking place after alien crafts land around the world, an expert linguist is recruited by the military to determine whether they come in peace or are a threat.",30.83786,7.2,5729,Jeremy Renner
12444,Adventure,tt0926084,Harry Potter and the Deathly Hallows: Part 1,"Harry, Ron and Hermione walk away from their last year at Hogwarts to find and destroy the remaining Horcruxes, putting an end to Voldemort's bid for immortality. But with Harry's beloved Dumbledore dead and Voldemort's unscrupulous Death Eaters on the loose, the world is more dangerous than ever.",23.300362,7.5,5708,Daniel Radcliffe
72190,Action,tt0816711,World War Z,"Life for former United Nations investigator Gerry Lane and his family seems content. Suddenly, the world is plagued by a mysterious infection turning whole human populations into rampaging mindless zombies. After barely escaping the chaos, Lane is persuaded to go on a mission to investigate this disease. What follows is a perilous trek around the world where Lane must brave horrific dangers and long odds to find answers before human civilization falls.",26.114917,6.7,5683,Brad Pitt
75656,Thrill,tt1670345,Now You See Me,An FBI agent and an Interpol detective track a team of illusionists who pull off bank heists during their performances and reward their audiences with the money.,17.852022,7.3,5635,Mark Ruffalo
675,Adventure,tt0373889,Harry Potter and the Order of the Phoenix,"Returning for his fifth year of study at Hogwarts, Harry is stunned to find that his warnings about the return of Lord Voldemort have been ignored. Left with no choice, Harry takes matters into his own hands, training a small group of students ??dubbed 'Dumbledore's Army' ??to defend themselves against the dark arts.",21.3643,7.4,5633,Daniel Radcliffe
259316,Adventure,tt3183660,Fantastic Beasts and Where to Find Them,"In 1926, Newt Scamander arrives at the Magical Congress of the United States of America with a magically expanded briefcase, which houses a number of dangerous creatures and their habitats. When the creatures escape from the briefcase, it sends the American wizarding authorities after Newt, and threatens to strain even further the state of magical and non-magical relations.",41.051421,7.2,5612,Eddie Redmayne
98,Action,tt0172495,Gladiator,"In the year 180, the death of emperor Marcus Aurelius throws the Roman Empire into chaos. Maximus is one of the Roman army's most capable and trusted generals and a key advisor to the emperor. As Marcus' devious son Commodus ascends to the throne, Maximus is set to be executed. He escapes, but is captured by slave traders. Renamed Spaniard and forced to become a gladiator, Maximus must battle to the death with other men for the amusement of paying audiences. His battle skills serve him well, and he becomes one of the most famous and admired men to fight in the Colosseum. Determined to avenge himself against the man who took away his freedom and laid waste to his family, Maximus believes that he can use his fame and skill in the ring to avenge the loss of his family and former glory. As the gladiator begins to challenge his rule, Commodus decides to put his own fighting mettle to the test by squaring off with Maximus in a battle to the death.",23.186667,7.9,5566,Joaquin Phoenix
198663,Action,tt1790864,The Maze Runner,"Set in a post-apocalyptic world, young Thomas is deposited in a community of boys after his memory is erased, soon learning they're all trapped in a maze that will require him to join forces with fellow ""runners"" for a shot at escape.",76.93789,7,5540,Dylan O'Brien
321612,Family,tt2771200,Beauty and the Beast,A live-action adaptation of Disney's version of the classic 'Beauty and the Beast' tale of a cursed prince and a beautiful young woman who helps him break the spell.,287.253654,6.8,5530,Emma Watson
8587,Family,tt0110357,The Lion King,A young lion cub named Simba can't wait to be king. But his uncle craves the title for himself and will stop at nothing to get it.,21.605761,8,5520,Jeremy Irons
245891,Action,tt2911666,John Wick,Ex-lunatic John Wick comes off his meds to track down the bounders that killed his dog and made off with his self-respect,183.870374,7,5499,Keanu Reeves
109445,Animation,tt2294629,Frozen,"Young princess Anna of Arendelle dreams about finding true love at her sister Elsa?ôs coronation. Fate takes her on a dangerous journey in an attempt to end the eternal winter that has fallen over the kingdom. She's accompanied by ice delivery man Kristoff, his reindeer Sven, and snowman Olaf. On an adventure where she will find out what friendship, courage, family, and true love really means.",24.248243,7.3,5440,Kristen Bell
767,Adventure,tt0417741,Harry Potter and the Half-Blood Prince,"As Harry begins his sixth year at Hogwarts, he discovers an old book marked as 'Property of the Half-Blood Prince', and begins to learn more about Lord Voldemort's dark past.",19.083723,7.4,5435,Daniel Radcliffe
862,Animation,tt0114709,Toy Story,"Led by Woody, Andy's toys live happily in his room until Andy's birthday brings Buzz Lightyear onto the scene. Afraid of losing his place in Andy's heart, Woody plots against Buzz. But when circumstances separate Buzz and Woody from their owner, the duo eventually learns to put aside their differences.",21.946943,7.7,5415,Tom Hanks
77338,Drama,tt1675434,Intouchables,A true story of two men who should never have met ??a quadriplegic aristocrat who was injured in a paragliding accident and a young man from the projects.,16.086919,8.2,5410,Omar Sy
557,Fantasy,tt0145487,Spider-Man,"After being bitten by a genetically altered spider, nerdy high school student Peter Parker is endowed with amazing powers.",29.413341,6.8,5398,Tom Holland
58,Adventure,tt0383574,Pirates of the Caribbean: Dead Man's Chest,"Captain Jack Sparrow works his way out of a blood debt with the ghostly Davey Jones, he also attempts to avoid eternal damnation.",29.455314,7,5380,Johnny Depp
9806,Action,tt0317705,The Incredibles,"Bob Parr has given up his superhero days to log in time as an insurance adjuster and raise his three children with his formerly heroic wife in suburbia. But when he receives a mysterious assignment, it's time to get back into costume.",22.220214,7.4,5290,Bradley Bird
82992,Action,tt1905041,Fast & Furious 6,"Hobbs has Dominic and Brian reassemble their crew to take down a team of mercenaries: Dominic unexpectedly gets convoluted also facing his presumed deceased girlfriend, Letty.",1.657637,6.7,5282,Paul Walker
49538,Action,tt1270798,X-Men: First Class,"Before Charles Xavier and Erik Lensherr took the names Professor X and Magneto, they were two young men discovering their powers for the first time. Before they were arch-enemies, they were closest of friends, working together with other mutants (some familiar, some new), to stop the greatest threat the world has ever known.",0.738633,7.1,5252,James McAvoy
70981,Science,tt1446714,Prometheus,"A team of explorers discover a clue to the origins of mankind on Earth, leading them on a journey to the darkest corners of the universe. There, they must fight a terrifying battle to save the future of the human race.",16.624854,6.3,5152,Noomi Rapace
857,Drama,tt0120815,Saving Private Ryan,"As U.S. troops storm the beaches of Normandy, three brothers lie dead on the battlefield, with a fourth trapped behind enemy lines. Ranger captain John Miller and seven men are tasked with penetrating German-held territory and bringing the boy home.",21.758054,7.9,5148,Tom Hanks
330459,Action,tt3748528,Rogue One: A Star Wars Story,A rogue band of resistance fighters unite for a mission to steal the Death Star plans and bring a new hope to the galaxy.,36.567575,7.4,5111,Felicity Jones
24,Action,tt0266697,Kill Bill: Vol. 1,"An assassin is shot at the altar by her ruthless employer, Bill and other members of their assassination circle ??but 'The Bride' lives to plot her vengeance. Setting out for some payback, she makes a death list and hunts down those who wronged her, saving Bill for last.",25.261865,7.7,5091,Uma Thurman
1865,Adventure,tt1298650,Pirates of the Caribbean: On Stranger Tides,"Captain Jack Sparrow crosses paths with a woman from his past, and he's not sure if it's love -- or if she's a ruthless con artist who's using him to find the fabled Fountain of Youth. When she forces him aboard the Queen Anne's Revenge, the ship of the formidable pirate Blackbeard, Jack finds himself on an unexpected adventure in which he doesn't know who to fear more: Blackbeard or the woman from his past.",27.88772,6.4,5068,Johnny Depp
297762,Action,tt0451279,Wonder Woman,An Amazon princess comes to the world of Man to become the greatest of the female superheroes.,294.337037,7.2,5025,Gal Gadot
137113,Action,tt1631867,Edge of Tomorrow,"Major Bill Cage is an officer who has never seen a day of combat when he is unceremoniously demoted and dropped into combat. Cage is killed within minutes, managing to take an alpha alien down with him. He awakens back at the beginning of the same day and is forced to fight and die again... and again - as physical contact with the alien has thrown him into a time loop.",31.982986,7.6,4979,Thomas Cruise
